{
  "schema_version": "vm547-maze-discovery-profiles-v1",
  "status": "OWNER_AUTHORIZED_DISCOVERY_PROJECTION",
  "authority_rule": "These records translate approved dossier reading material into bounded Scryfall discovery threads. They do not replace, strengthen, or rewrite certified identity semantics, and they do not rank cards or commanders.",
  "records": [
    {
      "identity_key": "WU",
      "color_identity": "wu",
      "mechanical_threads": [
        { "thread_id": "visible-restrictions", "label": "Taxes and visible restrictions", "interpretation": "Find cards that add costs or explicitly limit attacking or casting.", "query_clause": "(o:\"cost {1} more\" OR o:\"can't attack\" OR o:\"can't cast\")", "source_item_id": "lookfor_wu_1_public_rule_setting" },
        { "thread_id": "permission", "label": "Permission and counterspells", "interpretation": "Find cards whose function is countering a spell before it resolves.", "query_clause": "otag:counterspell", "source_item_id": "lookfor_wu_2_procedural_permission" },
        { "thread_id": "timed-enforcement", "label": "Timed enforcement", "interpretation": "Find Addendum wording, board-wide resets, or effects tied to a declared phase.", "query_clause": "(o:addendum OR otag:board-wipe OR o:\"during your main phase\")", "source_item_id": "lookfor_wu_3_timed_enforcement" }
      ],
      "story_terms": ["senate", "law", "order", "verdict"]
    },
    {
      "identity_key": "UB",
      "color_identity": "ub",
      "mechanical_threads": [
        { "thread_id": "hidden-information", "label": "Hands and hidden information", "interpretation": "Find cards that inspect a hand or the top of a library before acting.", "query_clause": "(o:\"look at target player's hand\" OR o:\"look at the top\")", "source_item_id": "lookfor_ub_1_hidden_information_leverage" },
        { "thread_id": "surveil-filtering", "label": "Surveil filtering", "interpretation": "Find cards with Surveil that filter the next draw and stock the graveyard.", "query_clause": "kw:surveil", "source_item_id": "lookfor_ub_2_surveil_filtering" },
        { "thread_id": "covert-infiltration", "label": "Evasion and selective theft", "interpretation": "Find threats that cannot be blocked or effects that take control of another card.", "query_clause": "(o:\"can't be blocked\" OR o:\"gain control of target\")", "source_item_id": "lookfor_ub_3_covert_infiltration" }
      ],
      "story_terms": ["Dimir", "secret", "shadow", "memory"]
    },
    {
      "identity_key": "BR",
      "color_identity": "br",
      "mechanical_threads": [
        { "thread_id": "spectacle-pressure", "label": "Spectacle and life-loss pressure", "interpretation": "Find Spectacle cards or effects that care whether an opponent lost life.", "query_clause": "(kw:spectacle OR o:\"lost life\")", "source_item_id": "lookfor_br_1_spectacle_pressure" },
        { "thread_id": "risk-for-release", "label": "Cards, life, or bodies as a cost", "interpretation": "Find effects that ask for life, a discarded card, or a sacrificed permanent as a cost.", "query_clause": "(o:\"pay life\" OR o:discard OR o:\"sacrifice a\")", "source_item_id": "lookfor_br_2_risk_for_release" },
        { "thread_id": "sacrifice-consequence", "label": "Sacrifice with a consequence", "interpretation": "Find sacrifice outlets and effects that reward a creature dying.", "query_clause": "(otag:sacrifice-outlet OR otag:death-trigger OR o:sacrifice)", "source_item_id": "lookfor_br_3_sacrifice_with_consequence" }
      ],
      "story_terms": ["Rakdos", "spectacle", "performance", "blood"]
    },
    {
      "identity_key": "RG",
      "color_identity": "rg",
      "mechanical_threads": [
        { "thread_id": "wild-reclamation", "label": "Ramp into creature pressure", "interpretation": "Find ramp that helps a creature-heavy plan claim the board quickly.", "query_clause": "(otag:ramp OR (t:creature o:\"add mana\"))", "source_item_id": "lookfor_rg_1_wild_reclamation" },
        { "thread_id": "clan-pressure", "label": "Attacks backed by trample", "interpretation": "Find creatures and effects that attack or push damage through with trample.", "query_clause": "(o:attack OR kw:trample)", "source_item_id": "lookfor_rg_2_clan_fed_pressure" },
        { "thread_id": "riot-momentum", "label": "Riot momentum", "interpretation": "Find Riot cards that choose immediate haste or visible growth.", "query_clause": "kw:riot", "source_item_id": "lookfor_rg_3_riot_momentum" }
      ],
      "story_terms": ["Gruul", "clan", "wild", "rubble"]
    },
    {
      "identity_key": "WG",
      "color_identity": "wg",
      "mechanical_threads": [
        { "thread_id": "convoke-community", "label": "Convoke community", "interpretation": "Find Convoke cards that let creatures help cast the next spell.", "query_clause": "kw:convoke", "source_item_id": "lookfor_wg_1_convoke_community" },
        { "thread_id": "wide-board-care", "label": "Tokens with shared protection", "interpretation": "Find token-making alongside effects that protect or strengthen the whole creature board.", "query_clause": "(o:token AND (o:indestructible OR o:hexproof OR o:\"creatures you control get\"))", "source_item_id": "lookfor_wg_2_go_wide_caretaking" },
        { "thread_id": "harmony-preservation", "label": "Lifegain and anthem preservation", "interpretation": "Find life gain or team-wide bonuses that preserve a shared board.", "query_clause": "(o:\"gain life\" OR o:\"creatures you control get\")", "source_item_id": "lookfor_wg_3_harmony_and_preservation" }
      ],
      "story_terms": ["Selesnya", "conclave", "harmony", "community"]
    },
    {
      "identity_key": "WB",
      "color_identity": "wb",
      "mechanical_threads": [
        { "thread_id": "obligation-engines", "label": "Death triggers and obligation engines", "interpretation": "Find death-trigger shells where a creature leaving creates the next payment or benefit.", "query_clause": "(otag:death-trigger OR o:\"whenever another creature dies\")", "source_item_id": "lookfor_wb_1_obligation_engines" },
        { "thread_id": "payment-pressure", "label": "Taxes and opponent drain", "interpretation": "Find cards that raise costs or make each opponent lose life.", "query_clause": "(o:\"cost {1} more\" OR (o:\"each opponent\" o:\"lose life\"))", "source_item_id": "lookfor_wb_2_payment_pressure" },
        { "thread_id": "afterlife-accounts", "label": "Afterlife accounts", "interpretation": "Find Afterlife cards that turn death into Spirit tokens.", "query_clause": "kw:afterlife", "source_item_id": "lookfor_wb_3_afterlife_accounts" }
      ],
      "story_terms": ["Orzhov", "debt", "contract", "coin"]
    },
    {
      "identity_key": "UR",
      "color_identity": "ur",
      "mechanical_threads": [
        { "thread_id": "prototype-velocity", "label": "Copy and adjust a spell", "interpretation": "Find effects that copy an instant or sorcery as the experiment develops.", "query_clause": "(o:copy AND (o:instant OR o:sorcery))", "source_item_id": "lookfor_ur_1_prototype_velocity" },
        { "thread_id": "jump-start", "label": "Jump-start iteration", "interpretation": "Find Jump-start cards that recast a known spell by discarding another card.", "query_clause": "kw:jump-start", "source_item_id": "lookfor_ur_2_jump_start_iteration" },
        { "thread_id": "overload", "label": "Overload breakthrough", "interpretation": "Find Overload cards that scale a targeted effect across every valid target.", "query_clause": "kw:overload", "source_item_id": "lookfor_ur_3_overload_breakthrough" }
      ],
      "story_terms": ["Izzet", "experiment", "laboratory", "invention"]
    },
    {
      "identity_key": "BG",
      "color_identity": "bg",
      "mechanical_threads": [
        { "thread_id": "reclamation-midrange", "label": "Trade, then reclaim", "interpretation": "Find cards that return spent permanents or creatures from the graveyard.", "query_clause": "(o:return AND o:graveyard)", "source_item_id": "lookfor_bg_1_reclamation_midrange" },
        { "thread_id": "graveyard-loops", "label": "Death and graveyard resource loops", "interpretation": "Find cards that connect dying or sacrifice to later graveyard value.", "query_clause": "((o:dies OR o:sacrifice) AND o:graveyard)", "source_item_id": "lookfor_bg_2_graveyard_resource_loops" },
        { "thread_id": "undergrowth-renewal", "label": "Undergrowth and graveyard counts", "interpretation": "Find Undergrowth or cards that count creature cards in a graveyard.", "query_clause": "(kw:undergrowth OR o:\"creature cards in your graveyard\")", "source_item_id": "lookfor_bg_3_undergrowth_and_renewal" }
      ],
      "story_terms": ["Golgari", "swarm", "rot", "undercity"]
    },
    {
      "identity_key": "UG",
      "color_identity": "ug",
      "mechanical_threads": [
        { "thread_id": "living-system-value", "label": "Creature-led ramp and card flow", "interpretation": "Find creatures that produce mana or turn creature growth into cards.", "query_clause": "(t:creature AND (o:\"add mana\" OR o:draw))", "source_item_id": "lookfor_ug_1_living_system_value" },
        { "thread_id": "biological-adaptation", "label": "Evolve, Graft, Adapt, and counters", "interpretation": "Find biological growth mechanics or +1/+1 counter text.", "query_clause": "(kw:evolve OR kw:graft OR kw:adapt OR o:\"+1/+1 counter\")", "source_item_id": "lookfor_ug_2_biological_adaptation" },
        { "thread_id": "pressure-response", "label": "Proliferate and responsive upgrades", "interpretation": "Find Proliferate or effects that add counters as the board changes.", "query_clause": "(kw:proliferate OR o:\"put a +1/+1 counter\")", "source_item_id": "lookfor_ug_3_clade_research_and_pressure_response" }
      ],
      "story_terms": ["Simic", "biomancer", "clade", "experiment"]
    },
    {
      "identity_key": "WR",
      "color_identity": "wr",
      "mechanical_threads": [